{
  "openapi": "3.0.3",
  "info": {
    "title": "Backoffice Example API",
    "description": "\n    Complete e-commerce platform API with user management and order processing.\n    \n    This API provides:\n    - User registration, authentication, and profile management\n    - Order creation, tracking, and status management\n    - Administrative functions and reporting\n    \n    All endpoints support standard HTTP status codes and include comprehensive error handling.\n  ",
    "version": "2.1.0",
    "contact": {
      "name": "CERTIFICATUM SİBER GÜVENLİK TEKNOLOJİLERİ A.Ş.",
      "email": "iletisim@certificatum.com.tr"
    },
    "license": {
      "name": "Certificatum Proprietary License"
    },
    "termsOfService": "https://example.com/terms"
  },
  "servers": [
    {
      "url": "https://api.ecommerce.example.com/v2",
      "description": "Production server"
    },
    {
      "url": "https://staging-api.ecommerce.example.com/v2",
      "description": "Staging server"
    },
    {
      "url": "http://localhost:3000",
      "description": "Development server"
    }
  ],
  "paths": {
    "/order": {
      "get": {
        "operationId": "getAllOrders",
        "summary": "Get allorders",
        "description": "Retrieves detailed information about the specified allorders",
        "tags": [
          "order"
        ],
        "parameters": [
          {
            "name": "status",
            "in": "query",
            "schema": {
              "type": "string",
              "enum": [
                "pending",
                "processing",
                "shipped",
                "delivered",
                "cancelled"
              ]
            },
            "description": "status parameter"
          },
          {
            "name": "userId",
            "in": "query",
            "schema": {
              "type": "integer",
              "minimum": 1
            },
            "description": "userId parameter"
          },
          {
            "name": "startDate",
            "in": "query",
            "schema": {
              "type": "string",
              "format": "date-time"
            },
            "description": "startDate parameter"
          },
          {
            "name": "endDate",
            "in": "query",
            "schema": {
              "type": "string",
              "format": "date-time"
            },
            "description": "endDate parameter"
          },
          {
            "name": "limit",
            "in": "query",
            "schema": {
              "type": "integer",
              "minimum": 1,
              "maximum": 100,
              "default": 20
            },
            "description": "limit parameter"
          },
          {
            "name": "offset",
            "in": "query",
            "schema": {
              "type": "integer",
              "minimum": 0,
              "default": 0
            },
            "description": "offset parameter"
          },
          {
            "name": "sortBy",
            "in": "query",
            "schema": {
              "type": "string",
              "enum": [
                "createdAt",
                "total",
                "status"
              ],
              "default": "createdAt"
            },
            "description": "sortBy parameter"
          },
          {
            "name": "sortOrder",
            "in": "query",
            "schema": {
              "type": "string",
              "enum": [
                "asc",
                "desc"
              ],
              "default": "desc"
            },
            "description": "sortOrder parameter"
          }
        ],
        "responses": {
          "200": {
            "description": "Successful response",
            "content": {
              "application/json": {
                "schema": {
                  "$ref": "#/components/schemas/GetAllOrdersResponse"
                }
              }
            },
            "headers": {
              "X-Server-Time": {
                "description": "Server processing time in milliseconds",
                "schema": {
                  "type": "string",
                  "example": "45.23ms"
                }
              },
              "X-Cervice-Request-Id": {
                "description": "Unique request identifier for tracing",
                "schema": {
                  "type": "string",
                  "example": "abc123xyz789"
                }
              }
            }
          },
          "400": {
            "$ref": "#/components/responses/ValidationError"
          },
          "401": {
            "$ref": "#/components/responses/UnauthorizedError"
          },
          "404": {
            "$ref": "#/components/responses/NotFoundError"
          },
          "500": {
            "$ref": "#/components/responses/ServerError"
          }
        }
      }
    },
    "/order/{orderId}": {
      "get": {
        "operationId": "getOrderById",
        "summary": "Get orderbyid",
        "description": "Retrieves detailed information about the specified orderbyid",
        "tags": [
          "order"
        ],
        "parameters": [
          {
            "name": "orderId",
            "in": "path",
            "required": true,
            "schema": {
              "type": "integer",
              "example": 789
            },
            "description": "OrderId identifier"
          }
        ],
        "responses": {
          "200": {
            "description": "Successful response",
            "content": {
              "application/json": {
                "schema": {
                  "$ref": "#/components/schemas/GetOrderByIdResponse"
                }
              }
            },
            "headers": {
              "X-Server-Time": {
                "description": "Server processing time in milliseconds",
                "schema": {
                  "type": "string",
                  "example": "45.23ms"
                }
              },
              "X-Cervice-Request-Id": {
                "description": "Unique request identifier for tracing",
                "schema": {
                  "type": "string",
                  "example": "abc123xyz789"
                }
              }
            }
          },
          "400": {
            "$ref": "#/components/responses/ValidationError"
          },
          "401": {
            "$ref": "#/components/responses/UnauthorizedError"
          },
          "404": {
            "$ref": "#/components/responses/NotFoundError"
          },
          "500": {
            "$ref": "#/components/responses/ServerError"
          }
        }
      },
      "patch": {
        "operationId": "updateOrder",
        "summary": "Update order",
        "description": "Partially updates the specified order",
        "tags": [
          "order"
        ],
        "parameters": [
          {
            "name": "orderId",
            "in": "path",
            "required": true,
            "schema": {
              "type": "integer",
              "example": 789
            },
            "description": "OrderId identifier"
          }
        ],
        "responses": {
          "200": {
            "description": "Successful response",
            "content": {
              "application/json": {
                "schema": {
                  "$ref": "#/components/schemas/UpdateOrderResponse"
                }
              }
            },
            "headers": {
              "X-Server-Time": {
                "description": "Server processing time in milliseconds",
                "schema": {
                  "type": "string",
                  "example": "45.23ms"
                }
              },
              "X-Cervice-Request-Id": {
                "description": "Unique request identifier for tracing",
                "schema": {
                  "type": "string",
                  "example": "abc123xyz789"
                }
              }
            }
          },
          "400": {
            "$ref": "#/components/responses/ValidationError"
          },
          "401": {
            "$ref": "#/components/responses/UnauthorizedError"
          },
          "404": {
            "$ref": "#/components/responses/NotFoundError"
          },
          "500": {
            "$ref": "#/components/responses/ServerError"
          }
        },
        "requestBody": {
          "required": true,
          "content": {
            "application/json": {
              "schema": {
                "$ref": "#/components/schemas/UpdateOrderRequest"
              }
            },
            "multipart/form-data": {
              "schema": {
                "$ref": "#/components/schemas/UpdateOrderRequest"
              }
            }
          }
        }
      }
    },
    "/order/{orderId}/cancel": {
      "post": {
        "operationId": "cancelOrder",
        "summary": "Create cancelorder",
        "description": "Creates a new cancelorder with the provided data",
        "tags": [
          "order"
        ],
        "parameters": [
          {
            "name": "orderId",
            "in": "path",
            "required": true,
            "schema": {
              "type": "integer",
              "example": 789
            },
            "description": "OrderId identifier"
          }
        ],
        "responses": {
          "201": {
            "description": "Successful response",
            "content": {
              "application/json": {
                "schema": {
                  "$ref": "#/components/schemas/CancelOrderResponse"
                }
              }
            },
            "headers": {
              "X-Server-Time": {
                "description": "Server processing time in milliseconds",
                "schema": {
                  "type": "string",
                  "example": "45.23ms"
                }
              },